{
  "schemaVersion": "1.0.0",
  "changeId": "EXAMPLE-001",
  "packetMode": "IMPLEMENTATION",
  "humanApproval": "GRANTED",
  "status": "READY_FOR_PM_REVIEW",
  "sourceIdentity": {"workspace": "./fictional-inventory-service", "referenceSnapshot": "./fictional-inventory-service-reference", "referenceHashes": {"src/InventoryBroadcaster.cs": "0123456789abcdef0123456789abcdef0123456789abcdef0123456789abcdef"}, "beforeHashesArtifact": "before/source-hashes-before.txt", "afterHashesArtifact": "after/source-hashes-after.txt"},
  "agentIdentity": "GitHub Copilot",
  "requestedIntent": "Add a stable warning identity for a contained inventory subscriber failure.",
  "nonGoals": ["No inventory mutation changes", "No deployment"],
  "changedFiles": [{"path": "src/InventoryBroadcaster.cs", "members": ["InvokeSafely"]}],
  "affectedBoundaries": ["warning logging", "subscriber exception containment"],
  "designRationale": "Use the existing logger and preserve the existing catch boundary.",
  "behaviorPreserved": ["peer subscribers continue", "subscriber exceptions remain contained"],
  "executedValidation": [{"command": "dotnet test tests/InventoryBroadcasterTests.csproj --filter FullyQualifiedName~InventoryBroadcasterTests", "workingDirectory": "./fictional-inventory-service", "startedAt": "2026-01-01T10:00:00Z", "completedAt": "2026-01-01T10:00:02Z", "exitCode": 0, "status": "PASS", "artifactReferences": ["after/focused-test.log"], "limitations": ["Focused unit tests only"]}],
  "unavailableValidation": ["JSON syntax validated; schema conformance validated with the package schema.", "No deployment or provider-redaction validation was run."],
  "expectedTelemetry": {"eventId": 4301, "eventName": "InventorySubscriberFailed", "level": "Warning", "outcome": "DEGRADED_SUCCESS"},
  "privacyExclusions": ["item identifier", "customer data", "raw exception contents"],
  "uncertainties": ["Provider rendering/redaction was not validated."],
  "rollbackInstructions": "Restore the listed authorized file from the reference snapshot.",
  "pilotMeasurements": "pilot-measurements.md",
  "humanDecisionStatus": "PENDING_PM_REVIEW",
  "nextPermittedAction": "HUMAN_REVIEW_ONLY",
  "evidenceArtifacts": ["before/source-hashes-before.txt", "after/source-hashes-after.txt", "after/focused-test.log"]
}
